UserID,Menu,Review,Total,Taste,Quantity,Delivery,Date,HasPicture,BiasFree,RestaurantID
so**,"경성부대찌개 3인분 （밀키트, 비조리）/1(리뷰 이벤트 참여(리뷰이벤트 참여（＋생면사리）_육개장))",앞으로 부대찌개는 여기다.,5,5,5,5,2023-03-23 07:15:54,1,0,1012359
ki**,"경성 육개장 더블 세트（반조리, 비조리） 3인분＋3인분/1(맛 선택(매운맛))",너무 맛있어서 또 시켜먹을거 같아요 :),5,5,5,5,2022-08-22 11:27:03,1,0,1012359
ac**,"경성'모둠'부대찌개 3인분 （밀키트, 비조리） /1(사리 추가선택(라면사리 (아는 맛....)),명동김치 추가 선택(명동맛김치 1kg (봉지)))","여기는 첨 시켰는데 맛있어요.
추가에 대한 오류가 있었지만 친절하게 바로 처리 해주시고  음식 간이 잘 맛아서 덕분에 맛있게 먹었어요..
제일 좋았던건 김치가 진정한 맛집이네용~~
김치 강추합니당~~",5,5,5,5,2022-08-10 19:11:51,0,1,1012359
ks**,,"맛은 간이 호불호가 갈릴 수 있지만 괜찮았고 양도 적당했습니다만
제품 겉에 가격표가 15,900원으로 떡하니 붙어있는데 제품 가격 자체를 4,000원이나 올려 받는게 조금 이해가 안되네요 배달비도 따로 내는데말이죠
여튼 직접 사러가지 않으면 다시 시켜보진 않을 것 같습니다.",3,4,3,3,2022-05-08 13:43:16,1,1,1012359
손님,"경성 파육개장 3인분 （반조리, 비조리）/1(맛 선택(매운맛))",단골되서 또 시켜먹어요 맛있습니다 :),5,5,5,5,2022-01-29 18:29:58,1,0,1012359
손님,"경성 파육개장 3인분 （반조리, 비조리）/1(맛 선택(매운맛))",양도 많고 국물도 얼큰하니 좋아요 또 시켜먹을께요 :),5,5,5,5,2022-01-21 18:29:20,1,0,1012359
